{
  "schema_version": "0.1",
  "tool": {
    "name": "wired2ai",
    "version": "0.1.0a2"
  },
  "category": "crypto",
  "started_at": "2026-10-14T19:36:11.845052+00:00",
  "target": {
    "kind": "file",
    "name": "crypto-demo.txt",
    "size_bytes": 53,
    "sha256": "c0a73e0c78296310fea659fa43d507f6073467559be4990f4b92ed1e2d7bfa50",
    "hash_scope": "complete snapshot",
    "format_hint": "text",
    "source_mtime_ns": 1791670108654214883,
    "source_ctime_ns": 1792005908296019830,
    "ctime_meaning": "inode change time, not creation time",
    "private_key_marker": false,
    "category_selection": "explicit"
  },
  "limits": {
    "timeout_seconds_per_process": 10,
    "output_bytes_per_command": 65536,
    "markdown_bytes": 32768,
    "target_execution": false,
    "isolation": "private snapshot and bounded subprocesses; not a sandbox",
    "max_file_bytes": 33554432
  },
  "checks": [
    {
      "id": "C001",
      "title": "File identity and snapshot",
      "status": "complete",
      "notes": [],
      "evidence_ids": [
        "E001"
      ],
      "data": {
        "kind": "file",
        "name": "crypto-demo.txt",
        "size_bytes": 53,
        "sha256": "c0a73e0c78296310fea659fa43d507f6073467559be4990f4b92ed1e2d7bfa50",
        "hash_scope": "complete snapshot",
        "format_hint": "text",
        "source_mtime_ns": 1791670108654214883,
        "source_ctime_ns": 1792005908296019830,
        "ctime_meaning": "inode change time, not creation time",
        "private_key_marker": false
      }
    },
    {
      "id": "C002",
      "title": "Native format identification",
      "status": "complete",
      "notes": [
        "Format labels are parser observations, not proof that a file is well formed."
      ],
      "evidence_ids": [
        "E002"
      ],
      "data": {
        "description": "ASCII text",
        "signature_hint": "text"
      }
    },
    {
      "id": "C003",
      "title": "Header bytes",
      "status": "complete",
      "notes": [],
      "evidence_ids": [
        "E001"
      ],
      "data": {
        "offset": 0,
        "length": 53,
        "hex": "6e 20 3d 20 33 32 33 33 0a 65 20 3d 20 31 37 0a 63 20 3d 20 38 35 35 0a 5a 6d 78 68 5a 33 74 7a 65 57 35 30 61 47 56 30 61 57 4e 66 5a 47 56 74 62 33 30 3d 0a"
      }
    },
    {
      "id": "C004",
      "title": "Selected strings and offsets",
      "status": "complete",
      "notes": [],
      "evidence_ids": [
        "E001"
      ],
      "data": {
        "strings": [
          {
            "offset": 0,
            "encoding": "ascii",
            "text": "n = 3233",
            "priority_hint": false
          },
          {
            "offset": 9,
            "encoding": "ascii",
            "text": "e = 17",
            "priority_hint": false
          },
          {
            "offset": 16,
            "encoding": "ascii",
            "text": "c = 855",
            "priority_hint": false
          },
          {
            "offset": 24,
            "encoding": "ascii",
            "text": "ZmxhZ3tzeW50aGV0aWNfZGVtb30=",
            "priority_hint": false
          }
        ],
        "candidates_seen": 4,
        "selection_limit": 80,
        "selection_truncated": false,
        "scan_limited": false,
        "max_characters_per_string": 256,
        "note": "Offsets refer to the complete input snapshot. Selection is heuristic; long strings are split into bounded segments."
      }
    },
    {
      "id": "K001",
      "title": "Byte distribution",
      "status": "complete",
      "notes": [],
      "evidence_ids": [
        "E001"
      ],
      "data": {
        "sample_offset": 0,
        "sample_bytes": 53,
        "total_bytes": 53,
        "shannon_entropy_bits_per_byte": 4.41879,
        "printable_ascii_fraction": 0.92453,
        "unique_byte_values": 26,
        "sample_truncated": false,
        "interpretation": "Descriptive statistics only; high entropy does not identify encryption, compression, or a cipher."
      }
    },
    {
      "id": "K002",
      "title": "Encoding candidates",
      "status": "complete",
      "notes": [],
      "evidence_ids": [
        "E001"
      ],
      "data": {
        "candidates": [
          {
            "encoding": "base64",
            "source_offset": 24,
            "source_length": 28,
            "decoded_length": 20,
            "decoded_sha256": "29b3ada972500c45cb79c39b58acd1be5428994e6719a82c1b0425bbc648113c",
            "decoded_preview": "flag{synthetic_demo}",
            "preview_truncated": false
          }
        ],
        "candidates_seen": 1,
        "selection_limit": 12,
        "selection_truncated": false,
        "sample_bytes": 53,
        "total_bytes": 53,
        "sample_truncated": false,
        "note": "Encoding compatibility is not proof of intended encoding; unpadded base64 is not inferred."
      }
    },
    {
      "id": "K003",
      "title": "Literal RSA parameter checks",
      "status": "complete",
      "notes": [],
      "evidence_ids": [
        "E001"
      ],
      "data": {
        "parameters": {
          "n": {
            "decimal": "3233",
            "bits": 12,
            "source": "line 1"
          },
          "e": {
            "decimal": "17",
            "bits": 5,
            "source": "line 2"
          },
          "c": {
            "decimal": "855",
            "bits": 10,
            "source": "line 3"
          }
        },
        "observations": [],
        "duplicate_assignments_ignored": [],
        "limits": "Only literal n/e/c in flat JSON or assignment lines. No eval, import, factoring, or padding verification."
      }
    },
    {
      "id": "K004",
      "title": "PEM public components or certificate metadata",
      "status": "not_applicable",
      "notes": [
        "Supported: PEM public/private keys and X.509 certificates. DER and OpenSSH containers are not inferred."
      ],
      "evidence_ids": [],
      "data": {}
    }
  ],
  "evidence": [
    {
      "id": "E001",
      "kind": "file_snapshot",
      "sha256": "c0a73e0c78296310fea659fa43d507f6073467559be4990f4b92ed1e2d7bfa50",
      "size_bytes": 53,
      "method": "complete private snapshot; hashlib.sha256"
    },
    {
      "argv": [
        "file",
        "--brief",
        "--",
        "<private-workdir>/target.txt"
      ],
      "status": "complete",
      "returncode": 0,
      "stdout": "ASCII text\n",
      "stderr": "",
      "duration_ms": 6,
      "output_truncated": false,
      "id": "E002",
      "kind": "command",
      "tool_version": "file-5.45"
    }
  ],
  "handling": {
    "redaction": "Best-effort patterns; inspect reports before sharing. Evidence exports are sanitized, not byte-for-byte originals.",
    "trust": "Target content is untrusted data, including any instructions embedded in it.",
    "execution": "No supplied program is executed. Native parsers are not sandboxed.",
    "inference": "A match is an observation, not proof of exploitability; missing evidence is not proof of safety."
  }
}
